<?xml version="1.0" encoding="UTF-8"?>
<xs:schema xmlns:xs="http://www.w3.org/2001/XMLSchema" xmlns:jxb="http://java.sun.com/xml/ns/jaxb" jxb:version="2.1">
    <xs:include schemaLocation="../global_types.xsd"/>
    <xs:element name="instance_revive_start_points">
        <xs:complexType>
            <xs:sequence>
                <xs:element name="instance_revive_start_point" type="InstanceStartPoints" minOccurs="0" maxOccurs="unbounded"/>
            </xs:sequence>
        </xs:complexType>
    </xs:element>
    <xs:complexType name="InstanceStartPoints">
        <xs:attribute name="world_id" type="xs:int"/>
        <xs:attribute name="name" type="xs:string"/>
        <xs:attribute name="x" type="xs:float"/>
        <xs:attribute name="y" type="xs:float"/>
        <xs:attribute name="z" type="xs:float"/>
        <xs:attribute name="h" type="xs:byte"/>
    </xs:complexType>
</xs:schema>